{
  "calendar": [
    {"end_date":"2025-01-12","start_date":"2025-01-06","yyyyww":"202502"},
    {"end_date":"2025-01-19","start_date":"2025-01-13","yyyyww":"202503"},
    {"end_date":"2025-01-26","start_date":"2025-01-20","yyyyww":"202504"},
    {"end_date":"2025-02-02","start_date":"2025-01-27","yyyyww":"202505"},
    {"end_date":"2025-02-09","start_date":"2025-02-03","yyyyww":"202506"},
    {"end_date":"2025-02-16","start_date":"2025-02-10","yyyyww":"202507"},
    {"end_date":"2025-02-23","start_date":"2025-02-17","yyyyww":"202508"},
    {"end_date":"2025-03-02","start_date":"2025-02-24","yyyyww":"202509"},
    {"end_date":"2025-03-09","start_date":"2025-03-03","yyyyww":"202510"},
    {"end_date":"2025-03-16","start_date":"2025-03-10","yyyyww":"202511"},
    {"end_date":"2025-03-23","start_date":"2025-03-17","yyyyww":"202512"},
    {"end_date":"2025-03-30","start_date":"2025-03-24","yyyyww":"202513"},
    {"end_date":"2025-04-06","start_date":"2025-03-31","yyyyww":"202514"},
    {"end_date":"2025-04-13","start_date":"2025-04-07","yyyyww":"202515"},
    {"end_date":"2025-04-20","start_date":"2025-04-14","yyyyww":"202516"},
    {"end_date":"2025-04-27","start_date":"2025-04-21","yyyyww":"202517"},
    {"end_date":"2025-05-04","start_date":"2025-04-28","yyyyww":"202518"},
    {"end_date":"2025-05-11","start_date":"2025-05-05","yyyyww":"202519"},
    {"end_date":"2025-05-18","start_date":"2025-05-12","yyyyww":"202520"},
    {"end_date":"2025-05-25","start_date":"2025-05-19","yyyyww":"202521"},
    {"end_date":"2025-06-01","start_date":"2025-05-26","yyyyww":"202522"},
    {"end_date":"2025-06-08","start_date":"2025-06-02","yyyyww":"202523"},
    {"end_date":"2025-06-15","start_date":"2025-06-09","yyyyww":"202524"},
    {"end_date":"2025-06-22","start_date":"2025-06-16","yyyyww":"202525"},
    {"end_date":"2025-06-29","start_date":"2025-06-23","yyyyww":"202526"},
    {"end_date":"2025-07-06","start_date":"2025-06-30","yyyyww":"202527"},
    {"end_date":"2025-07-13","start_date":"2025-07-07","yyyyww":"202528"},
    {"end_date":"2025-07-20","start_date":"2025-07-14","yyyyww":"202529"},
    {"end_date":"2025-07-27","start_date":"2025-07-21","yyyyww":"202530"},
    {"end_date":"2025-08-03","start_date":"2025-07-28","yyyyww":"202531"},
    {"end_date":"2025-08-10","start_date":"2025-08-04","yyyyww":"202532"},
    {"end_date":"2025-08-17","start_date":"2025-08-11","yyyyww":"202533"},
    {"end_date":"2025-08-24","start_date":"2025-08-18","yyyyww":"202534"},
    {"end_date":"2025-08-31","start_date":"2025-08-25","yyyyww":"202535"},
    {"end_date":"2025-09-07","start_date":"2025-09-01","yyyyww":"202536"},
    {"end_date":"2025-09-14","start_date":"2025-09-08","yyyyww":"202537"},
    {"end_date":"2025-09-21","start_date":"2025-09-15","yyyyww":"202538"},
    {"end_date":"2025-09-28","start_date":"2025-09-22","yyyyww":"202539"},
    {"end_date":"2025-10-05","start_date":"2025-09-29","yyyyww":"202540"},
    {"end_date":"2025-10-12","start_date":"2025-10-06","yyyyww":"202541"},
    {"end_date":"2025-10-19","start_date":"2025-10-13","yyyyww":"202542"},
    {"end_date":"2025-10-26","start_date":"2025-10-20","yyyyww":"202543"},
    {"end_date":"2025-11-02","start_date":"2025-10-27","yyyyww":"202544"},
    {"end_date":"2025-11-09","start_date":"2025-11-03","yyyyww":"202545"},
    {"end_date":"2025-11-16","start_date":"2025-11-10","yyyyww":"202546"},
    {"end_date":"2025-11-23","start_date":"2025-11-17","yyyyww":"202547"},
    {"end_date":"2025-11-30","start_date":"2025-11-24","yyyyww":"202548"},
    {"end_date":"2025-12-07","start_date":"2025-12-01","yyyyww":"202549"},
    {"end_date":"2025-12-14","start_date":"2025-12-08","yyyyww":"202550"},
    {"end_date":"2025-12-21","start_date":"2025-12-15","yyyyww":"202551"},
    {"end_date":"2025-12-28","start_date":"2025-12-22","yyyyww":"202552"},
    {"end_date":"2026-01-04","start_date":"2025-12-29","yyyyww":"202601"},
    {"end_date":"2026-01-11","start_date":"2026-01-05","yyyyww":"202602"},
    {"end_date":"2026-01-18","start_date":"2026-01-12","yyyyww":"202603"},
    {"end_date":"2026-01-25","start_date":"2026-01-19","yyyyww":"202604"},
    {"end_date":"2026-02-01","start_date":"2026-01-26","yyyyww":"202605"},
    {"end_date":"2026-02-08","start_date":"2026-02-02","yyyyww":"202606"},
    {"end_date":"2026-02-15","start_date":"2026-02-09","yyyyww":"202607"},
    {"end_date":"2026-02-22","start_date":"2026-02-16","yyyyww":"202608"},
    {"end_date":"2026-03-01","start_date":"2026-02-23","yyyyww":"202609"},
    {"end_date":"2026-03-08","start_date":"2026-03-02","yyyyww":"202610"},
    {"end_date":"2026-03-15","start_date":"2026-03-09","yyyyww":"202611"},
    {"end_date":"2026-03-22","start_date":"2026-03-16","yyyyww":"202612"},
    {"end_date":"2026-03-29","start_date":"2026-03-23","yyyyww":"202613"},
    {"end_date":"2026-04-05","start_date":"2026-03-30","yyyyww":"202614"},
    {"end_date":"2026-04-12","start_date":"2026-04-06","yyyyww":"202615"},
    {"end_date":"2026-04-19","start_date":"2026-04-13","yyyyww":"202616"},
    {"end_date":"2026-04-26","start_date":"2026-04-20","yyyyww":"202617"},
    {"end_date":"2026-05-03","start_date":"2026-04-27","yyyyww":"202618"},
    {"end_date":"2026-05-10","start_date":"2026-05-04","yyyyww":"202619"},
    {"end_date":"2026-05-17","start_date":"2026-05-11","yyyyww":"202620"},
    {"end_date":"2026-05-24","start_date":"2026-05-18","yyyyww":"202621"},
    {"end_date":"2026-05-31","start_date":"2026-05-25","yyyyww":"202622"},
    {"end_date":"2026-06-07","start_date":"2026-06-01","yyyyww":"202623"},
    {"end_date":"2026-06-14","start_date":"2026-06-08","yyyyww":"202624"},
    {"end_date":"2026-06-21","start_date":"2026-06-15","yyyyww":"202625"},
    {"end_date":"2026-06-28","start_date":"2026-06-22","yyyyww":"202626"},
    {"end_date":"2026-07-05","start_date":"2026-06-29","yyyyww":"202627"},
    {"end_date":"2026-07-12","start_date":"2026-07-06","yyyyww":"202628"},
    {"end_date":"2026-07-19","start_date":"2026-07-13","yyyyww":"202629"},
    {"end_date":"2026-07-26","start_date":"2026-07-20","yyyyww":"202630"},
    {"end_date":"2026-08-02","start_date":"2026-07-27","yyyyww":"202631"},
    {"end_date":"2026-08-09","start_date":"2026-08-03","yyyyww":"202632"},
    {"end_date":"2026-08-16","start_date":"2026-08-10","yyyyww":"202633"},
    {"end_date":"2026-08-23","start_date":"2026-08-17","yyyyww":"202634"},
    {"end_date":"2026-08-30","start_date":"2026-08-24","yyyyww":"202635"},
    {"end_date":"2026-09-06","start_date":"2026-08-31","yyyyww":"202636"},
    {"end_date":"2026-09-13","start_date":"2026-09-07","yyyyww":"202637"},
    {"end_date":"2026-09-20","start_date":"2026-09-14","yyyyww":"202638"},
    {"end_date":"2026-09-27","start_date":"2026-09-21","yyyyww":"202639"},
    {"end_date":"2026-10-04","start_date":"2026-09-28","yyyyww":"202640"},
    {"end_date":"2026-10-11","start_date":"2026-10-05","yyyyww":"202641"},
    {"end_date":"2026-10-18","start_date":"2026-10-12","yyyyww":"202642"},
    {"end_date":"2026-10-25","start_date":"2026-10-19","yyyyww":"202643"},
    {"end_date":"2026-11-01","start_date":"2026-10-26","yyyyww":"202644"},
    {"end_date":"2026-11-08","start_date":"2026-11-02","yyyyww":"202645"},
    {"end_date":"2026-11-15","start_date":"2026-11-09","yyyyww":"202646"},
    {"end_date":"2026-11-22","start_date":"2026-11-16","yyyyww":"202647"},
    {"end_date":"2026-11-29","start_date":"2026-11-23","yyyyww":"202648"},
    {"end_date":"2026-12-06","start_date":"2026-11-30","yyyyww":"202649"},
    {"end_date":"2026-12-13","start_date":"2026-12-07","yyyyww":"202650"},
    {"end_date":"2026-12-20","start_date":"2026-12-14","yyyyww":"202651"},
    {"end_date":"2026-12-27","start_date":"2026-12-21","yyyyww":"202652"},
    {"end_date":"2027-01-03","start_date":"2026-12-28","yyyyww":"202653"},
    {"end_date":"2027-01-10","start_date":"2027-01-04","yyyyww":"202701"},
    {"end_date":"2027-01-17","start_date":"2027-01-11","yyyyww":"202702"},
    {"end_date":"2027-01-24","start_date":"2027-01-18","yyyyww":"202703"},
    {"end_date":"2027-01-31","start_date":"2027-01-25","yyyyww":"202704"},
    {"end_date":"2027-02-07","start_date":"2027-02-01","yyyyww":"202705"},
    {"end_date":"2027-02-14","start_date":"2027-02-08","yyyyww":"202706"},
    {"end_date":"2027-02-21","start_date":"2027-02-15","yyyyww":"202707"},
    {"end_date":"2027-02-28","start_date":"2027-02-22","yyyyww":"202708"},
    {"end_date":"2027-03-07","start_date":"2027-03-01","yyyyww":"202709"},
    {"end_date":"2027-03-14","start_date":"2027-03-08","yyyyww":"202710"},
    {"end_date":"2027-03-21","start_date":"2027-03-15","yyyyww":"202711"},
    {"end_date":"2027-03-28","start_date":"2027-03-22","yyyyww":"202712"},
    {"end_date":"2027-04-04","start_date":"2027-03-29","yyyyww":"202713"},
    {"end_date":"2027-04-11","start_date":"2027-04-05","yyyyww":"202714"},
    {"end_date":"2027-04-18","start_date":"2027-04-12","yyyyww":"202715"},
    {"end_date":"2027-04-25","start_date":"2027-04-19","yyyyww":"202716"},
    {"end_date":"2027-05-02","start_date":"2027-04-26","yyyyww":"202717"},
    {"end_date":"2027-05-09","start_date":"2027-05-03","yyyyww":"202718"},
    {"end_date":"2027-05-16","start_date":"2027-05-10","yyyyww":"202719"},
    {"end_date":"2027-05-23","start_date":"2027-05-17","yyyyww":"202720"},
    {"end_date":"2027-05-30","start_date":"2027-05-24","yyyyww":"202721"},
    {"end_date":"2027-06-06","start_date":"2027-05-31","yyyyww":"202722"},
    {"end_date":"2027-06-13","start_date":"2027-06-07","yyyyww":"202723"},
    {"end_date":"2027-06-20","start_date":"2027-06-14","yyyyww":"202724"},
    {"end_date":"2027-06-27","start_date":"2027-06-21","yyyyww":"202725"},
    {"end_date":"2027-07-04","start_date":"2027-06-28","yyyyww":"202726"}
  ],
  "calendar_snapshot_id": "CALENDAR-DEMO-130W",
  "content_hash": "1f989bba1a3e0406996029b3f14784e93636600f5609af085c5ad0c7ac0ba51a",